{
  "vulnerability_id": "VULN-002",
  "validation_status": "CONFIRMED",
  "security_impact_verified": true,
  "reproduction_log": "Reproduction request to http://127.0.0.1:3000/api/transactions/search?q=%27+OR+1%3D1+-- returned HTTP 200.",
  "reasoning": "Independently verified SQL injection returned records outside user's account.",
  "validated_at": "2026-09-27T14:47:25.443104Z"
}