{
  "vulnerability_id": "VULN-003",
  "validation_status": "CONFIRMED",
  "security_impact_verified": true,
  "reproduction_log": "Reproduction request to http://127.0.0.1:3000/api/transfers returned HTTP 200.",
  "reasoning": "Independently verified stored XSS payload was stored without sanitization.",
  "validated_at": "2026-09-27T14:47:25.454794Z"
}