{
  "vulnerability_id": "VULN-004",
  "validation_status": "CONFIRMED",
  "security_impact_verified": true,
  "reproduction_log": "Reproduction request to http://127.0.0.1:3000/api/profile/upload returned HTTP 200.",
  "reasoning": "Independently verified server accepts arbitrary .html files without extension validation.",
  "validated_at": "2026-09-27T12:50:29.858678Z"
}