{
  "vulnerability_id": "VULN-005",
  "validation_status": "CONFIRMED",
  "security_impact_verified": true,
  "reproduction_log": "Reproduction request to http://127.0.0.1:3000/api/admin/users returned HTTP 200.",
  "reasoning": "Independently verified admin endpoint access via client header override.",
  "validated_at": "2026-09-27T12:50:29.894637Z"
}